{
  "schema_version": "1.0.0",
  "identity": {
    "id": "analyze-video",
    "name": "analyze-video",
    "description": "专业法医级视频抽帧与视觉分析技能。支持场景检测、多阶段帧提取、LLM逐帧审图、事件时间线和结构化报告生成。适用于事件检测、异常行为、车祸取证、打架、摔倒、聚集、拥堵、烟火、入侵、占道等高精度监控分析场景。"
  },
  "scope": {
    "scenes": [
      "video_surveillance"
    ],
    "is_public": false,
    "task_types": [
      "video_analysis",
      "scene_detection",
      "frame_review",
      "incident_timeline",
      "forensic_report"
    ],
    "input_types": [
      "mp4",
      "mov",
      "avi",
      "mkv",
      "video_path"
    ],
    "output_types": [
      "frame_metadata",
      "scene_segments",
      "timeline_report"
    ]
  },
  "routing": {
    "routing_text": "名称：analyze-video\n描述：专业法医级视频抽帧与视觉分析技能。支持场景检测、多阶段帧提取、LLM逐帧审图、事件时间线和结构化报告生成。适用于事件检测、异常行为、车祸取证、打架、摔倒、聚集、拥堵、烟火、入侵、占道等高精度监控分析场景。\n适用场景：video_surveillance。\n适用任务：video_analysis, scene_detection, frame_review, incident_timeline, forensic_report, frame_based_event_detection。\n输入类型：mp4, mov, avi, mkv, video_path。\n输出类型：frame_metadata, scene_segments, visual_timeline, event_candidates, timeline_report。\n适合使用：分析视频事件；通过抽帧视觉分析异常行为；监控事件检测；逐帧审图生成事件时间线；视频取证。\n不适合使用：生成AI视频；只剪辑视频片段；只做目标检测；只做摄像头健康检查。",
    "positive_triggers": [
      "分析视频事件",
      "通过抽帧视觉分析异常行为",
      "监控事件检测",
      "逐帧审图生成事件时间线",
      "视频取证"
    ],
    "negative_triggers": [
      "生成AI视频",
      "只剪辑视频片段",
      "只做目标检测",
      "只做摄像头健康检查"
    ],
    "keywords": [
      "analyze-video",
      "事件检测",
      "异常行为",
      "抽帧",
      "视觉分析",
      "监控事件",
      "frame review"
    ],
    "anti_keywords": [
      "文生视频",
      "AI视频生成",
      "pcap",
      "法规",
      "台账"
    ]
  },
  "body": {
    "source": "SKILL.md",
    "content": "---\nname: analyze-video\ndescription: 专业法医级视频抽帧与视觉分析技能。支持场景检测、多阶段帧提取、LLM逐帧审图、事件时间线和结构化报告生成。适用于事件检测、异常行为、车祸取证、打架、摔倒、聚集、拥堵、烟火、入侵、占道等高精度监控分析场景。\nversion: 1.0.0\nauthor: jdrodriguez\ncompatibility: \">=2.0.0\"\nallowed-tools:\n  - bash\n  - read_file\n  - write_file\n---\n\n# 专业视频取证分析技能 (Analyze Video)\n\n## Execution Priority\n\nPrioritize calling this skill's `scripts/extract_frames.py` entrypoint first to produce timestamped frames and metadata. After extraction, the Agent must inspect the frame images directly and build the event timeline from visible evidence.\n\n## 技能说明\n`analyze-video` 是一个高精度的视频帧分析工具，专为“城市超脑”中的法医级取证和事件检测设计。它通过 `ffmpeg` 在本地执行场景变更检测，并自动将长视频划分为多个“章节”，以便 Agent 对抽出的关键帧进行多模态视觉审核，而不是只依赖目标检测框或规则脚本。\n\n## 核心能力\n- **自动分段**：自动识别视频中的重要场景并进行章节切分。\n- **自适应抓图**：在场景剧烈变化处自动增加抓拍频率，确保不遗漏关键动作。\n- **LLM逐帧审图**：要求 Agent 直接查看抽帧图片，记录对象、动作、空间关系、状态变化和不确定性。\n- **结构化分析**：为每一帧生成精确的时间戳和元数据，并输出事件时间线。\n\n## 触发关键词\n- \"分析视频\", \"事件检测\", \"异常行为\", \"监控事件\", \"取证\", \"视频回溯\", \"analyze-video\", \"检查监控\", \"打架\", \"车祸\", \"摔倒\", \"聚集\", \"拥堵\", \"烟火\", \"入侵\", \"占道\"\n\n## 权限声明\n- `bash`: 用于执行 `python3 /mnt/skills/custom/analyze-video/scripts/extract_frames.py`。\n- `ffmpeg`: 核心依赖。\n\n## 操作规范 (Guidelines)\n1. **工作流程**：\n   - 调用：`python3 /mnt/skills/custom/analyze-video/scripts/extract_frames.py <video_path> --output-dir /mnt/user-data/workspace/video_review`。\n   - 读取产生的 `metadata.json` 了解视频章节分布。\n   - 先查看全局粗采样帧，建立事件候选时间线。\n   - 对候选时间段查看 dense/keyframe 结果，逐帧描述可见主体、动作、空间关系、状态变化和证据质量。\n   - 将视觉观察转换成结构化事件候选：`event_type`、`time_range`、`evidence_frame_ids`、`reason`、`confidence`、`requires_review`。\n2. **注意事项**：\n   - 提取过程可能耗时较长（视视频长度而定）。\n   - 不要只根据文件名、用户描述或检测标签判断事件；必须基于抽帧图片中的可见证据。\n   - 模糊、遮挡、视角不足或单帧证据不足时，应降低置信度并标记人工复核。\n   - 最终产物应汇总为一份包含时间轴的 PDF 或 Markdown 报告。\n\n## 示例 (Example)\n**用户：** \"分析一下 `/mnt/datasets/surveillance/raw/test_video_01.mp4` 里的异常行为。\"\n**Agent 动作：**\n- 执行：`python3 /mnt/skills/custom/analyze-video/scripts/extract_frames.py /mnt/datasets/surveillance/raw/test_video_01.mp4`\n- 根据输出的 `output_dir` 读取元数据。\n- 回复用户： \"视频提取完成，共识别出 3 个关键场景，正在为您逐一分析...\"\n"
  },
  "execution": {
    "required_tools": [
      "read_file",
      "bash",
      "ffmpeg"
    ],
    "optional_tools": [
      "write_file",
      "ffprobe"
    ],
    "allowed_file_patterns": [
      "*.mp4",
      "*.mov",
      "*.avi",
      "*.mkv",
      "*.flv",
      "*.webm"
    ],
    "can_run_standalone": true
  },
  "routing_policy": {
    "priority": 88,
    "conflict_group": "analyze-video",
    "prefer_when": [
      "分析视频事件",
      "通过抽帧视觉分析异常行为",
      "监控事件检测",
      "逐帧审图生成事件时间线",
      "视频取证"
    ],
    "defer_when": [
      "生成AI视频",
      "只剪辑视频片段",
      "只做目标检测",
      "只做摄像头健康检查"
    ]
  },
  "source": {
    "skill_dir": "skills/custom/analyze-video",
    "skill_md_path": "skills/custom/analyze-video/SKILL.md",
    "skill_md_hash": "sha256:aeffc23ab60da5c0160485d1e28a6d5776e413520d45ec3e0aed07d9f24b936b",
    "generated_at": "2026-05-21T00:00:00Z",
    "generator_version": "manual-independent-0.2.0"
  },
  "embedding": {
    "model": "SkillRouter-Embedding-0.6B",
    "text_hash": "sha256:31d905c7a10ff7487f4417cea95144f1496daa842c4c4ca7ab39f0369ec2a39a",
    "es_index": "citybrain-skill-router-cards",
    "es_doc_id": "analyze-video"
  }
}
