{
    "schema_version":  "1.0.0",
    "identity":  {
                     "id":  "profile_urban_region",
                     "name":  "profile_urban_region",
                     "description":  "Use this skill when the user wants to identify urban functional regions such as residential, commercial, transit, leisure, or mixed-use areas by combining trajectory activity and POI evidence."
                 },
    "scope":  {
                  "scenes":  [
                                 "spatiotemporal_trajectory"
                             ],
                  "is_public":  false,
                  "task_types":  [
                                     "profile_urban_region",
                                     "spatiotemporal_trajectory"
                                 ],
                  "input_types":  [
                                      "csv",
                                      "tsv",
                                      "json",
                                      "jsonl",
                                      "trajectory_records",
                                      "evidence_jsonl"
                                  ],
                  "output_types":  [
                                       "region_profiles.jsonl",
                                       "summary.json"
                                   ]
              },
    "routing":  {
                    "routing_text":  "名称：profile_urban_region\n描述：Use this skill when the user wants to identify urban functional regions such as residential, commercial, transit, leisure, or mixed-use areas by combining trajectory activity and POI evidence.\n适用场景：spatiotemporal_trajectory。\n适用任务：profile_urban_region, spatiotemporal_trajectory。\n输入类型：csv, tsv, json, jsonl, trajectory_records, evidence_jsonl。\n输出类型：region_profiles.jsonl, summary.json。\n适合使用：处理时空轨迹、GPS、签到、OD、区域热度、路线异常、轨迹模式、流量预测等移动性分析任务。\n不适合使用：网络流量 PCAP 分析；政策法规检索；财务台账分析；纯通用闲聊。",
                    "positive_triggers":  [
                                              "Use this skill when the user wants to identify urban functional regions such as residential, commercial, transit, leisure, or mixed-use areas by combining trajectory activity and POI evidence.",
                                              "处理或分析时空轨迹数据",
                                              "对 GPS、签到、OD、区域热度、路线或移动模式进行计算"
                                          ],
                    "negative_triggers":  [
                                              "分析 pcap/pcapng/cap 网络流量文件",
                                              "检索政策法规或合规条款",
                                              "处理财务台账或票据审计"
                                          ],
                    "keywords":  [
                                     "profile",
                                     "urban",
                                     "region",
                                     "spatiotemporal",
                                     "trajectory",
                                     "GPS",
                                     "OD",
                                     "geohash",
                                     "staypoint",
                                     "轨迹",
                                     "时空",
                                     "移动性",
                                     "spatiotemporal_trajectory"
                                 ],
                    "anti_keywords":  [
                                          "pcap",
                                          "network_traffic",
                                          "网络流量",
                                          "政策法规",
                                          "财务台账"
                                      ]
                },
    "body":  {
                 "source":  "SKILL.md",
                 "content":  "---\nname: profile_urban_region\ndescription: Use this skill when the user wants to identify urban functional regions such as residential, commercial, transit, leisure, or mixed-use areas by combining trajectory activity and POI evidence.\nmetadata:\n  short-description: Identify urban functional attributes by region.\n---\n\n# profile_urban_region\n\nUse this Skill to classify region functions from activity time signatures and optional POI category distributions.\n\n## Command\n\n```bash\ncd /mnt/skills/custom/profile_urban_region\npython3 scripts/profile_urban_region.py \\\n  --input /path/to/cleaned_points.jsonl \\\n  --output-dir /path/to/output \\\n  --time-col utc \\\n  --lat-col Latitude \\\n  --lon-col Longitude \\\n  --user-col user_id \\\n  --poi-input /path/to/pois.csv \\\n  --poi-category-col \"Venue Category Name\"\n```\n\n## Outputs\n\n- `region_profiles.jsonl`\n- `summary.json`\n\n## Algorithm\n\n- Geohash region aggregation\n- Morning/workday/evening/night activity signature\n- POI category keyword scoring\n- Functional label ranking with mixed-use fallback\n\n## Next Skills\n\nUse profile outputs with `$fuse_spatial_evidence`, or combine with hotspots and anomaly outputs for region portraits.\n"
             },
    "execution":  {
                      "required_tools":  [
                                             "read_file",
                                             "bash",
                                             "python3"
                                         ],
                      "optional_tools":  [
                                             "write_file",
                                             "chart_generator"
                                         ],
                      "allowed_file_patterns":  [
                                                    "*.csv",
                                                    "*.tsv",
                                                    "*.json",
                                                    "*.jsonl",
                                                    "*.ndjson"
                                                ],
                      "can_run_standalone":  true,
                      "can_compose_with":  [
                                               "fuse_spatial_evidence"
                                           ]
                  },
    "routing_policy":  {
                           "priority":  90,
                           "conflict_group":  "spatiotemporal_trajectory",
                           "prefer_when":  [
                                               "用户问题涉及 GPS 轨迹、签到、移动路径、OD、区域热度、停留点、路线异常或时空预测",
                                               "输入数据是轨迹点、staypoints、trips、region metrics 或 trajectory evidence"
                                           ],
                           "defer_when":  [
                                              "任务明确属于网络流量、安全协议或 PCAP 分析",
                                              "任务明确属于政策法规、财务台账或其他非时空轨迹场景"
                                          ]
                       },
    "source":  {
                   "skill_dir":  "skills/custom/profile_urban_region",
                   "skill_md_path":  "skills/custom/profile_urban_region/SKILL.md",
                   "skill_md_hash":  "sha256:9325e348958f863707755d89dd80173bcb8533c2f3ba461b12e1b11ffc9d2b6b",
                   "generated_at":  "2026-05-27T08:45:12Z",
                   "generator_version":  "spatial-temporal-routercard-1.0.0"
               },
    "embedding":  {
                      "model":  "SkillRouter-Embedding-0.6B",
                      "text_hash":  "sha256:3146fb70816d21a8b5546380065bacfed322cb98e466b74ee05e508dd73e2be2",
                      "es_index":  "citybrain-skill-router-cards",
                      "es_doc_id":  "profile_urban_region"
                  }
}