{
    "schema_version":  "1.0.0",
    "identity":  {
                     "id":  "anonymize_trajectory_data",
                     "name":  "anonymize_trajectory_data",
                     "description":  "Use this skill when the user asks to anonymize, desensitize, privacy-protect, differentially perturb, k-anonymize, hash user IDs, grid-generalize, or prepare sensitive GPS/check-in trajectory data before retrieval or LLM analysis."
                 },
    "scope":  {
                  "scenes":  [
                                 "spatiotemporal_trajectory"
                             ],
                  "is_public":  false,
                  "task_types":  [
                                     "anonymize_trajectory_data",
                                     "spatiotemporal_trajectory"
                                 ],
                  "input_types":  [
                                      "csv",
                                      "tsv",
                                      "json",
                                      "jsonl",
                                      "trajectory_records",
                                      "region_heat_jsonl",
                                      "evidence_jsonl"
                                  ],
                  "output_types":  [
                                       "evidence.jsonl",
                                       "privacy_report.json"
                                   ]
              },
    "routing":  {
                    "routing_text":  "名称：anonymize_trajectory_data\n描述：Use this skill when the user asks to anonymize, desensitize, privacy-protect, differentially perturb, k-anonymize, hash user IDs, grid-generalize, or prepare sensitive GPS/check-in trajectory data before retrieval or LLM analysis.\n适用场景：spatiotemporal_trajectory。\n适用任务：anonymize_trajectory_data, spatiotemporal_trajectory。\n输入类型：csv, tsv, json, jsonl, trajectory_records, region_heat_jsonl, evidence_jsonl。\n输出类型：evidence.jsonl, privacy_report.json。\n适合使用：处理时空轨迹、GPS、签到、OD、区域热度、路线异常、轨迹模式、流量预测等移动性分析任务。\n不适合使用：网络流量 PCAP 分析；政策法规检索；财务台账分析；纯通用闲聊。",
                    "positive_triggers":  [
                                              "Use this skill when the user asks to anonymize, desensitize, privacy-protect, differentially perturb, k-anonymize, hash user IDs, grid-generalize, or prepare sensitive GPS/check-in trajectory data before retrieval or LLM analysis.",
                                              "处理或分析时空轨迹数据",
                                              "对 GPS、签到、OD、区域热度、路线或移动模式进行计算"
                                          ],
                    "negative_triggers":  [
                                              "分析 pcap/pcapng/cap 网络流量文件",
                                              "检索政策法规或合规条款",
                                              "处理财务台账或票据审计"
                                          ],
                    "keywords":  [
                                     "anonymize",
                                     "trajectory",
                                     "data",
                                     "spatiotemporal",
                                     "GPS",
                                     "OD",
                                     "geohash",
                                     "staypoint",
                                     "轨迹",
                                     "时空",
                                     "移动性",
                                     "spatiotemporal_trajectory"
                                 ],
                    "anti_keywords":  [
                                          "pcap",
                                          "network_traffic",
                                          "网络流量",
                                          "政策法规",
                                          "财务台账"
                                      ]
                },
    "body":  {
                 "source":  "SKILL.md",
                 "content":  "---\nname: anonymize_trajectory_data\ndescription: Use this skill when the user asks to anonymize, desensitize, privacy-protect, differentially perturb, k-anonymize, hash user IDs, grid-generalize, or prepare sensitive GPS/check-in trajectory data before retrieval or LLM analysis.\nmetadata:\n  short-description: 对敏感时空轨迹做用户哈希、坐标加噪、时间桶化、网格泛化与 K 匿名过滤。\n---\n\n# anonymize_trajectory_data\n\nUse this Skill before exposing sensitive trajectory evidence to retrieval or report generation.\n\n## Command\n\n```bash\ncd /mnt/skills/custom/anonymize_trajectory_data\npython3 scripts/anonymize_trajectory_data.py --input /path/to/raw_trajectory.csv --output-dir /path/to/output --epsilon 1.0 --geohash-precision 5 --min-users 5\n```\n\n## Input\n\nCSV with user, latitude, longitude, timestamp, and optional category columns.\n\nUseful flags:\n\n```bash\n--user-col user_id --lat-col latitude --lon-col longitude --time-col timestamp --cat-col category\n--city-label Shanghai --epsilon 1.0 --geohash-precision 5 --min-users 5 --salt trajectory_v1 --seed 42\n```\n\n## Outputs\n\n- `evidence.jsonl`\n- `privacy_report.json`\n\n## Algorithm\n\n- Irreversible user-id hashing\n- Laplace coordinate noise for differential privacy\n- Time bucketing and geohash grid generalization\n- K-anonymity filtering for sparse cells\n- Privacy provenance fields for retrieval evidence\n\n## Next Skills\n\nUse `evidence.jsonl` with `$search_spatiotemporal`, `$analyze_region_heat`, or `$fuse_spatial_evidence`.\n"
             },
    "execution":  {
                      "required_tools":  [
                                             "read_file",
                                             "bash",
                                             "python3"
                                         ],
                      "optional_tools":  [
                                             "write_file",
                                             "chart_generator"
                                         ],
                      "allowed_file_patterns":  [
                                                    "*.csv",
                                                    "*.tsv",
                                                    "*.json",
                                                    "*.jsonl",
                                                    "*.ndjson"
                                                ],
                      "can_run_standalone":  true,
                      "can_compose_with":  [
                                               "search_spatiotemporal",
                                               "analyze_region_heat",
                                               "fuse_spatial_evidence"
                                           ]
                  },
    "routing_policy":  {
                           "priority":  90,
                           "conflict_group":  "spatiotemporal_trajectory",
                           "prefer_when":  [
                                               "用户问题涉及 GPS 轨迹、签到、移动路径、OD、区域热度、停留点、路线异常或时空预测",
                                               "输入数据是轨迹点、staypoints、trips、region metrics 或 trajectory evidence"
                                           ],
                           "defer_when":  [
                                              "任务明确属于网络流量、安全协议或 PCAP 分析",
                                              "任务明确属于政策法规、财务台账或其他非时空轨迹场景"
                                          ]
                       },
    "source":  {
                   "skill_dir":  "skills/custom/anonymize_trajectory_data",
                   "skill_md_path":  "skills/custom/anonymize_trajectory_data/SKILL.md",
                   "skill_md_hash":  "sha256:dcd50256012a0caa43408d9d781f82bee9aed49ea2231f04df3e1b209af80a2b",
                   "generated_at":  "2026-05-27T08:45:12Z",
                   "generator_version":  "spatial-temporal-routercard-1.0.0"
               },
    "embedding":  {
                      "model":  "SkillRouter-Embedding-0.6B",
                      "text_hash":  "sha256:f37d4dfdf732abdfcd4074db2b0892864e0231e2dbddc454d96b06335a051a41",
                      "es_index":  "citybrain-skill-router-cards",
                      "es_doc_id":  "anonymize_trajectory_data"
                  }
}